{
  "schema": 1,
  "product": "NHOS App Library",
  "generated_at": "2026-10-28T12:32:26Z",
  "cell_count": 225,
  "apps": [
    {
      "id": "bat_view",
      "name": {
        "en": "Battery & Link",
        "ja": "バッテリーと接続",
        "zh-CN": "电量与连接"
      },
      "summary": {
        "en": "Battery level, link state and time offline; low alert.",
        "ja": "電池残量・接続状態・オフライン時間。低残量を警告。",
        "zh-CN": "电量、连接状态与离线时长，低电量时提醒。"
      },
      "version": "1.0.0",
      "author": "wenzi7777",
      "license": "MPL-2.0",
      "category": "diagnostics",
      "capabilities": [
        "display",
        "drive_ext_led",
        "drive_led",
        "emit_event",
        "link",
        "power",
        "read_matrix",
        "tick"
      ],
      "kind": "flow",
      "min_os": "v1.6.0",
      "nodes": 24,
      "estimated_us": 15,
      "memory_bytes": 0,
      "device_path": "apps/bat_view.nha",
      "package": {
        "url": "https://raw.githubusercontent.com/wenzi7777/NHOS-App-Library/main/dist/bat_view/bat_view-1.0.0.nha",
        "sha256": "386f80c0ed8ce8c8483a95a5c44f84a70b2bc95d03baa3060c3e8f87572fd210",
        "size": 1172
      },
      "icon_url": "https://raw.githubusercontent.com/wenzi7777/NHOS-App-Library/main/apps/bat_view/icon.svg",
      "readme_url": {
        "en": "https://raw.githubusercontent.com/wenzi7777/NHOS-App-Library/main/apps/bat_view/README.md",
        "ja": "https://raw.githubusercontent.com/wenzi7777/NHOS-App-Library/main/apps/bat_view/README.ja.md",
        "zh-CN": "https://raw.githubusercontent.com/wenzi7777/NHOS-App-Library/main/apps/bat_view/README.zh-CN.md"
      }
    },
    {
      "id": "compass",
      "name": {
        "en": "Compass",
        "ja": "コンパス",
        "zh-CN": "指南针"
      },
      "summary": {
        "en": "Heading and field strength; detects a nearby magnet.",
        "ja": "方位と磁場強度を表示し、近くの磁石を検出します。",
        "zh-CN": "显示方位与磁场强度，检测附近的磁铁。"
      },
      "version": "1.0.0",
      "author": "wenzi7777",
      "license": "MPL-2.0",
      "category": "sensing",
      "capabilities": [
        "display",
        "drive_ext_led",
        "emit_event",
        "read_mag",
        "read_matrix",
        "tick"
      ],
      "kind": "flow",
      "min_os": "v1.6.0",
      "nodes": 18,
      "estimated_us": 11,
      "memory_bytes": 0,
      "device_path": "apps/compass.nha",
      "package": {
        "url": "https://raw.githubusercontent.com/wenzi7777/NHOS-App-Library/main/dist/compass/compass-1.0.0.nha",
        "sha256": "f84471081488520ac908e5cc2cae5a6ce88e3778169d171b9632d55d19db1411",
        "size": 1082
      },
      "icon_url": "https://raw.githubusercontent.com/wenzi7777/NHOS-App-Library/main/apps/compass/icon.svg",
      "readme_url": {
        "en": "https://raw.githubusercontent.com/wenzi7777/NHOS-App-Library/main/apps/compass/README.md",
        "ja": "https://raw.githubusercontent.com/wenzi7777/NHOS-App-Library/main/apps/compass/README.ja.md",
        "zh-CN": "https://raw.githubusercontent.com/wenzi7777/NHOS-App-Library/main/apps/compass/README.zh-CN.md"
      }
    },
    {
      "id": "mark",
      "name": {
        "en": "Experiment Marker",
        "ja": "実験マーカー",
        "zh-CN": "实验标记"
      },
      "summary": {
        "en": "Button press records a numbered mark in the event log.",
        "ja": "ボタンを押すと番号付きマークをイベントログに記録します。",
        "zh-CN": "按下按钮即在事件日志中记录带编号的标记。"
      },
      "version": "1.0.0",
      "author": "wenzi7777",
      "license": "MPL-2.0",
      "category": "research",
      "capabilities": [
        "button",
        "display",
        "emit_event",
        "read_matrix"
      ],
      "kind": "flow",
      "min_os": "v1.6.0",
      "nodes": 11,
      "estimated_us": 7,
      "memory_bytes": 0,
      "device_path": "apps/mark.nha",
      "package": {
        "url": "https://raw.githubusercontent.com/wenzi7777/NHOS-App-Library/main/dist/mark/mark-1.0.0.nha",
        "sha256": "c3a1a0ebbac7aa17ce3c2d0db12404d1f875fc07d6722c00cc6e430d4098144a",
        "size": 669
      },
      "icon_url": "https://raw.githubusercontent.com/wenzi7777/NHOS-App-Library/main/apps/mark/icon.svg",
      "readme_url": {
        "en": "https://raw.githubusercontent.com/wenzi7777/NHOS-App-Library/main/apps/mark/README.md",
        "ja": "https://raw.githubusercontent.com/wenzi7777/NHOS-App-Library/main/apps/mark/README.ja.md",
        "zh-CN": "https://raw.githubusercontent.com/wenzi7777/NHOS-App-Library/main/apps/mark/README.zh-CN.md"
      }
    },
    {
      "id": "sat_watch",
      "name": {
        "en": "Saturation Watch",
        "ja": "飽和ウォッチ",
        "zh-CN": "饱和监看"
      },
      "summary": {
        "en": "Flags cells reading at the readout ceiling while it happens.",
        "ja": "読み出し回路の上限に張り付いたセルをその場で知らせます。",
        "zh-CN": "实时提示读数达到读出电路上限的单元。"
      },
      "version": "1.0.0",
      "author": "wenzi7777",
      "license": "MPL-2.0",
      "category": "research",
      "capabilities": [
        "display",
        "drive_ext_led",
        "drive_led",
        "emit_event",
        "read_matrix"
      ],
      "kind": "flow",
      "min_os": "v1.6.0",
      "nodes": 16,
      "estimated_us": 144,
      "memory_bytes": 0,
      "device_path": "apps/sat_watch.nha",
      "package": {
        "url": "https://raw.githubusercontent.com/wenzi7777/NHOS-App-Library/main/dist/sat_watch/sat_watch-1.0.0.nha",
        "sha256": "020a7974c03791f0b7ab520e6e010b2751e8e0b53919e7af5ef43bca9ba3be4f",
        "size": 987
      },
      "icon_url": "https://raw.githubusercontent.com/wenzi7777/NHOS-App-Library/main/apps/sat_watch/icon.svg",
      "readme_url": {
        "en": "https://raw.githubusercontent.com/wenzi7777/NHOS-App-Library/main/apps/sat_watch/README.md",
        "ja": "https://raw.githubusercontent.com/wenzi7777/NHOS-App-Library/main/apps/sat_watch/README.ja.md",
        "zh-CN": "https://raw.githubusercontent.com/wenzi7777/NHOS-App-Library/main/apps/sat_watch/README.zh-CN.md"
      }
    },
    {
      "id": "sensors",
      "name": {
        "en": "Sensor Scope",
        "ja": "センサースコープ",
        "zh-CN": "传感器示波器"
      },
      "summary": {
        "en": "Live IMU, magnetometer and battery readings, charted.",
        "ja": "IMU・磁気センサー・電池の値をリアルタイムにグラフ表示。",
        "zh-CN": "实时图表显示 IMU、磁力计与电池读数。"
      },
      "version": "1.0.0",
      "author": "wenzi7777",
      "license": "MPL-2.0",
      "category": "diagnostics",
      "capabilities": [],
      "kind": "readout",
      "min_os": "v1.6.0",
      "nodes": 0,
      "estimated_us": 0,
      "memory_bytes": 0,
      "device_path": "apps/sensors.nha",
      "package": {
        "url": "https://raw.githubusercontent.com/wenzi7777/NHOS-App-Library/main/dist/sensors/sensors-1.0.0.nha",
        "sha256": "25aa651baf42496053b71fed848b68a8aaa5939f46ce7e87cf0954694df1da1f",
        "size": 1499
      },
      "icon_url": "https://raw.githubusercontent.com/wenzi7777/NHOS-App-Library/main/apps/sensors/icon.svg",
      "readme_url": {
        "en": "https://raw.githubusercontent.com/wenzi7777/NHOS-App-Library/main/apps/sensors/README.md",
        "ja": "https://raw.githubusercontent.com/wenzi7777/NHOS-App-Library/main/apps/sensors/README.ja.md",
        "zh-CN": "https://raw.githubusercontent.com/wenzi7777/NHOS-App-Library/main/apps/sensors/README.zh-CN.md"
      }
    },
    {
      "id": "sysmon",
      "name": {
        "en": "System Monitor",
        "ja": "システムモニタ",
        "zh-CN": "系统监视器"
      },
      "summary": {
        "en": "Live scheduler, service and app activity for a device.",
        "ja": "デバイスのスケジューラ・サービス・アプリの稼働状況をリアルタイムに表示します。",
        "zh-CN": "实时显示设备的调度器、服务与应用运行状况。"
      },
      "version": "1.0.0",
      "author": "wenzi7777",
      "license": "MPL-2.0",
      "category": "diagnostics",
      "capabilities": [],
      "kind": "readout",
      "min_os": "v1.2.0",
      "nodes": 0,
      "estimated_us": 0,
      "memory_bytes": 0,
      "device_path": "apps/sysmon.nha",
      "package": {
        "url": "https://raw.githubusercontent.com/wenzi7777/NHOS-App-Library/main/dist/sysmon/sysmon-1.0.0.nha",
        "sha256": "f8e046979fb5254897097e153db0fcf3cf9eb5bc9018de82b0d354c5cc04e98f",
        "size": 3237
      },
      "icon_url": "https://raw.githubusercontent.com/wenzi7777/NHOS-App-Library/main/apps/sysmon/icon.svg"
    },
    {
      "id": "taps",
      "name": {
        "en": "Tap Counter",
        "ja": "タップカウンター",
        "zh-CN": "点按计数"
      },
      "summary": {
        "en": "Counts presses and times each hold; button resets.",
        "ja": "押下回数を数え、各押下の保持時間を計測。ボタンでリセット。",
        "zh-CN": "统计按压次数并记录每次按住时长，按按钮清零。"
      },
      "version": "1.0.0",
      "author": "wenzi7777",
      "license": "MPL-2.0",
      "category": "rehab",
      "capabilities": [
        "button",
        "display",
        "drive_ext_led",
        "emit_event",
        "read_matrix"
      ],
      "kind": "flow",
      "min_os": "v1.6.0",
      "nodes": 17,
      "estimated_us": 78,
      "memory_bytes": 0,
      "device_path": "apps/taps.nha",
      "package": {
        "url": "https://raw.githubusercontent.com/wenzi7777/NHOS-App-Library/main/dist/taps/taps-1.0.0.nha",
        "sha256": "11b62ac972a26db4d6a5f888484a3214e270b3a7650f04975005e0979618368a",
        "size": 964
      },
      "icon_url": "https://raw.githubusercontent.com/wenzi7777/NHOS-App-Library/main/apps/taps/icon.svg",
      "readme_url": {
        "en": "https://raw.githubusercontent.com/wenzi7777/NHOS-App-Library/main/apps/taps/README.md",
        "ja": "https://raw.githubusercontent.com/wenzi7777/NHOS-App-Library/main/apps/taps/README.ja.md",
        "zh-CN": "https://raw.githubusercontent.com/wenzi7777/NHOS-App-Library/main/apps/taps/README.zh-CN.md"
      }
    }
  ]
}
